<?xml version="1.0" encoding="UTF-8"?>
<!--
    This file is part of InfoGrid(tm). You may not use this file except in
    compliance with the InfoGrid license. The InfoGrid license and important
    disclaimers are contained in the file LICENSE.InfoGrid.txt that you should
    have received with InfoGrid. If you have not received LICENSE.InfoGrid.txt
    or you do not consent to all aspects of the license and the disclaimers,
    no license is granted; do not use this file.
 
    For more information about InfoGrid go to http://infogrid.org/

    Copyright 1998-2009 by R-Objects Inc. dba NetMesh Inc., Johannes Ernst
    All rights reserved.
-->

<!DOCTYPE model PUBLIC '-//InfoGrid.org//InfoGrid Model//EN' 'http://infogrid.org/dtds/model.dtd'>
<model>
    <subjectarea ID="org.infogrid.model.Web">
        <name>org.infogrid.model.Web</name>
        <username>Web Subject Area</username>
        <userdescription>This Subject Area provides concepts that may be used to represent
information found on the web.</userdescription>

        <entitytype ID="org.infogrid.model.Web/WebResource">
            <name>WebResource</name>
            <username>Web Resource</username>
            <userdescription>The resource at a URI. The URI is found in the identifier property.</userdescription>
            <maybeusedasforwardreference/>
        </entitytype>

        <relationshiptype ID="org.infogrid.model.Web/WebResource_HasLinkTo_WebResource">
            <name>WebResource_HasLinkTo_WebResource</name>
            <username>has link to</username>
            <userdescription>Captures the link relationship between Web Resources, as expressed
in HTTP Link headers, HTML link tags and the like. Specific types of link relationships are
expressed using subtypes of this RelationshipType.</userdescription>
            <src>
              <e>org.infogrid.model.Web/WebResource</e>
              <MultiplicityValue>0:N</MultiplicityValue>
            </src>
            <dest>
              <e>org.infogrid.model.Web/WebResource</e>
              <MultiplicityValue>0:N</MultiplicityValue>
            </dest>
        </relationshiptype>
    </subjectarea>
</model>
