<?xml version="1.0" encoding="UTF-8"?>
<!--
    This file is part of InfoGrid(tm). You may not use this file except in
    compliance with the InfoGrid license. The InfoGrid license and important
    disclaimers are contained in the file LICENSE.InfoGrid.txt that you should
    have received with InfoGrid. If you have not received LICENSE.InfoGrid.txt
    or you do not consent to all aspects of the license and the disclaimers,
    no license is granted; do not use this file.

    For more information about InfoGrid go to http://infogrid.org/

    Copyright 1998-2009 by R-Objects Inc. dba NetMesh Inc., Johannes Ernst
    All rights reserved.
-->

<!DOCTYPE model PUBLIC '-//InfoGrid.org//InfoGrid Model//EN' 'http://infogrid.org/dtds/model.dtd'>
<model>
    <subjectarea ID="org.infogrid.model.Bookmark#_SubjectArea">
        <name>org.infogrid.model.Bookmark</name>
        <username>Bookmarking Subject Area</username>
        <userdescription>Bookmarking Subject Area</userdescription>

        <entitytype ID="org.infogrid.model.Bookmark#BookmarkCollection">
            <name>BookmarkCollection</name>
            <username>Bookmark Library</username>
            <userdescription>A collection of book marks.</userdescription>
            <propertytype ID="org.infogrid.model.Bookmark#BookmarkCollection/Name">
                <name>Name</name>
                <username>Name</username>
                <userdescription>The name of the Bookmark Collection</userdescription>
                <datatype>
                    <StringDataType/>
                </datatype>
                <isoptional/>
            </propertytype>
        </entitytype>

        <entitytype ID="org.infogrid.model.Bookmark#Bookmark">
            <name>Bookmark</name>
            <username>Bookmark</username>
            <userdescription>A bookmark</userdescription>
            <propertytype ID="org.infogrid.model.Bookmark#Bookmark/Name">
                <name>Name</name>
                <username>Name</username>
                <userdescription>The name of the bookmark</userdescription>
                <datatype>
                    <StringDataType/>
                </datatype>
                <isoptional/>
            </propertytype>
        </entitytype>

        <relationshiptype ID="org.infogrid.model.Bookmark#BookmarkCollection_Collects_Bookmark">
            <name>BookmarkCollection_Collects_Bookmark</name>
            <username>Collects</username>
            <userdescription>Relates a Bookmark to the BookmarkCollection in which it is collected.</userdescription>
            <src>
              <e>org.infogrid.model.Bookmark#BookmarkCollection</e>
              <MultiplicityValue>0:N</MultiplicityValue>
            </src>
            <dest>
              <e>org.infogrid.model.Bookmark#Bookmark</e>
              <MultiplicityValue>1:1</MultiplicityValue>
            </dest>
        </relationshiptype>

        <relationshiptype ID="org.infogrid.model.Bookmark#Bookmark_Bookmarks_MeshObject">
            <name>Bookmark_Bookmarks_MeshObject</name>
            <username>bookmarks</username>
            <userdescription>Relates the Bookmark to the MeshObject that is being bookmarked.</userdescription>
            <src>
              <e>org.infogrid.model.Bookmark#Bookmark</e>
              <MultiplicityValue>1:1</MultiplicityValue>
            </src>
            <dest>
              <MultiplicityValue>0:N</MultiplicityValue>
            </dest>
        </relationshiptype>
        
        <relationshiptype ID="org.infogrid.model.Tagging#MeshObject_Uses_BookmarkCollection">
            <name>MeshObject_Uses_BookmarkCollection</name>
            <username>Uses</username>
            <userdescription>Enables a MeshObject (such as a person) to identify those BookmarkCollections they use.</userdescription>
            <src>
              <MultiplicityValue>0:N</MultiplicityValue>
            </src>
            <dest>
              <e>org.infogrid.model.Bookmark#BookmarkCollection</e>
              <MultiplicityValue>0:N</MultiplicityValue>
            </dest>
        </relationshiptype>

    </subjectarea>
</model>
